{
  "$id": "challenge-schema",
  "$schema": "https://json-schema.org/draft-07/schema",
  "title": "challenge",
  "description": "Describes high-level information for a challenge",
  "properties": {
    "$schema": {
    },
    "id": {
      "description": "UUID for this challenge, must be unique amongst other challenges",
      "type": "string",
      "format": "uuid",
      "pattern": "^[0-9a-fA-F]{8}\\b-[0-9a-fA-F]{4}\\b-[0-9a-fA-F]{4}\\b-[0-9a-fA-F]{4}\\b-[0-9a-fA-F]{12}$"
    },
    "slug": {
      "description": "URL-friendly name for this challenge, must be unique within a challenge set",
      "type": "string",
      "pattern": "^[a-z0-9]+(?:-[a-z0-9]+)*$"
    },
    "name": {
      "description": "Human-facing name of the challenge",
      "type": "string"
    },
    "description": {
      "description": "Human-facing description of the challenge",
      "type": "string"
    },
    "provisioner": {
      "description": "Provisioner-backend that is used to create environments for this challenge",
      "properties": {
        "type": {
          "type": "string",
          "enum": [
            "kubernetes"
          ]
        }
      },
      "required": [
        "type"
      ]
    },
    "documentation": {
      "description": "List of documentation pages for this challenge in order",
      "type": "array",
      "items": {
        "type": "object",
        "properties": {
          "name": {
            "description": "Short name to be used in the tab",
            "type": "string"
          },
          "path": {
            "description": "Path to the documentation in Markdown format",
            "type": "string"
          }
        },
        "required": [
          "name",
          "path"
        ]
      }
    }
  },
  "additionalProperties": false,
  "required": [
    "id",
    "slug",
    "name",
    "description",
    "provisioner",
    "documentation"
  ]
}
