{
  "$schema": "../../../schemas/challenge.schema.json",
  "id": "e6ddf451-e5e6-423a-bcd0-6841d738d421",
  "slug": "rock-paper-scissors",
  "name": "Rock Paper Scissors",
  "description": "Game of Rock Paper Scissors",
  "provisioner": {
    "type": "kubernetes"
  },
  "documentation": [
    {
      "name": "RockPaperScissors",
      "path": "docs/RockPaperScissors.md"
    }
  ]
}