{
  "$schema": "../../../schemas/challenge.schema.json",
  "id": "e0867c69-92cd-4e50-b23b-b782ec3e251f",
  "slug": "yahtzee",
  "name": "Yahtzee",
  "description": "Game of Yahtzee",
  "provisioner": {
    "type": "kubernetes"
  },
  "documentation": [
    {
      "name": "Yahtzee",
      "path": "docs/Yahtzee.md"
    }
  ]
}