{
  "$schema": "../../../schemas/challenge.schema.json",
  "id": "737ca46c-c31d-4e32-9702-e18a691b8641",
  "slug": "caesar-cipher",
  "name": "Caesar Cipher",
  "description": "This is a challenge that demonstrates caesar cipher",
  "provisioner": {
    "type": "kubernetes"
  },
  "documentation": [
    {
      "name": "Cryptography",
      "path": "docs/1-Cryptography.md"
    },
    {
      "name": "Caesar cipher",
      "path": "docs/Caesar-cipher.md"
    },
    {
      "name": "Terminal Usage",
      "path": "docs/Terminal_Use.md"
    }
  ]
}