{
  "$schema": "../../../schemas/challenge.schema.json",
  "id": "d927f959-67aa-4e4b-8da2-f65ed17fa915",
  "slug": "sqlinjection",
  "name": "SQL Injection Example",
  "description": "This is an example challenge to demonstrate web environments",
  "provisioner": {
    "type": "kubernetes"
  },
  "documentation": []
}
