{
  "$schema": "../../../schemas/challenge.schema.json",
  "id": "e0867c69-92cd-4e50-b23b-b782ec3e251f",
  "slug": "prize",
  "name": "prize",
  "description": "Game of prize",
  "provisioner": {
    "type": "kubernetes"
  },
  "documentation": [
    {
      "name": "Prize",
      "path": "docs/DoorGame.md"
    }
  ]
}